{
  "id": "tf-anisotropic-resize",
  "kind": "transform",
  "description": "Anisotropic model resize: different x/y scale factors between model input and capture.",
  "case": {
    "capture": {
      "widthPx": 1920,
      "heightPx": 1080
    },
    "window": {
      "originX": 0,
      "originY": 0,
      "widthPx": 1920,
      "heightPx": 1080
    },
    "executorUnits": "desktop_physical_pixels",
    "resize": {
      "outWidthPx": 1008,
      "outHeightPx": 672
    }
  },
  "expected": {
    "captureToDesktop": {
      "scaleX": 1.0,
      "scaleY": 1.0,
      "offsetX": 0.0,
      "offsetY": 0.0
    },
    "modelToCapture": {
      "scaleX": 1.9047619047619047,
      "scaleY": 1.6071428571428572,
      "offsetX": 0.0,
      "offsetY": 0.0
    },
    "roundTripTolerancePx": 0.75
  }
}
