{
  "id": "tf-crop-offset",
  "kind": "transform",
  "description": "Crop window selects a sub-rectangle; model origin maps to crop origin.",
  "case": {
    "capture": {
      "widthPx": 1920,
      "heightPx": 1080
    },
    "window": {
      "originX": 0,
      "originY": 0,
      "widthPx": 1920,
      "heightPx": 1080
    },
    "executorUnits": "desktop_physical_pixels",
    "crop": {
      "x": 100,
      "y": 50,
      "widthPx": 800,
      "heightPx": 600
    }
  },
  "expected": {
    "captureToDesktop": {
      "scaleX": 1.0,
      "scaleY": 1.0,
      "offsetX": 0.0,
      "offsetY": 0.0
    },
    "modelToCapture": {
      "scaleX": 1.0,
      "scaleY": 1.0,
      "offsetX": 100.0,
      "offsetY": 50.0
    },
    "roundTripTolerancePx": 0.5
  }
}
